User Name,Thumbnail URL,Comment Time,Likes,Comment Text
Saad Ahmed,https://yt3.ggpht.com/ytc/AGIKgqOnFGgyNSvHsBt_jJq2jc12iTq8fjvsRayM9hJzcg=s48-c-k-c0x00ffffff-no-rj,1 year ago (edited),3,"Hi, great video as it provides a good insight into hiring culture of SWE/IT related jobs in Pakistan. I am a 1st semester student at ITU Lahore. What advice would you give to someone who started their CS journey before joining university and are currently ahead of their classmates? I think I have gotten my fundamentals right along with some OOP, I think I only need to polish my understanding and practice concepts like inheritance and polymorphism now. With that, I also love to watch random computerphile or any other good CS related video when I am free so I think I have a decent idea of what's to come. What advice would you have for me if my end goal is to land a good tech job abroad? Should I continue to stay a bit ahead or should I just go with the flow? Note that I don't plan on learning any framework or anything like that until I get my data structures right. Thanks "
Aafaq Ahmed,https://yt3.ggpht.com/ytc/AGIKgqPVTf-tiqZIK4lkNxSImewyDbBvYiU4thIMDor1ow=s48-c-k-c0x00ffffff-no-rj,8 months ago,0,"Hi, First of all I would like to acknowledge that video was really good. I am 6th semester student of BSCS but I also have 2+ year of experience in developing iOS app with swift. Should I consider joining as a Junior iOS dev? Should my expectations be same as fresh graduate? I got diverse experience while doing freelancing. 

Also one more question, should I bring my laptop on interview?"
Ali Ahmed Khan,,1 year ago,0,"Ehmad bhai the work you are doing is making the path clear for all the CS Undergrads. Thank You! Ehmad bhai please help me wih one confusion, should I focus on making myself confident with concepts of DSA, OOP, DB or should I learn stuff like web development, android or ios ... like I know both holds importance but as an undergrad in my third year what should I focus more on.? please make a video on this many of my colleagues are confused"
Sultan Muammad,https://yt3.ggpht.com/ytc/AGIKgqO5pD_PYD6e1PbOiJyWHYVbjPLa_1vQSAXmA6NRvluYt-3ABI7HwhUpCRNg22j4=s48-c-k-c0x00ffffff-no-rj,1 year ago,3,"For the first time in my life, i'm thankful toYoutube for showing me your channel.
Its my last year in software Engineering and i have made up my mind to master atleast one domain before im graduated. 
But i'm so confused about what to do, which domain to pick. 
But now i believe i would be able to get my answers, thanks to this channel."
Farid Ullah,https://yt3.ggpht.com/ytc/AGIKgqNMRLk6kc4Ghs9G0QbMj_oJ7fOAIq48oWAABUHOpw=s48-c-k-c0x00ffffff-no-rj,1 year ago (edited),0,"Sir, 
Do you think getting a coursera certificate will give me a little advantage in the interviews or its fine to just have a skill without any certificate?"
Muhammad Zain Abbas Baloch,https://yt3.ggpht.com/ytc/AGIKgqMLZ5mb5u5bTSg3E2UdVaSDswkXvWDzw1NQGsm5m9I=s48-c-k-c0x00ffffff-no-rj,1 year ago,2,"Plz, make videos on complete roadmaps for becoming self-taught Web developer, app developer, data scientist, AI expert and game developers THROUGH INTERNET RESOURCES. 

Your work is great ️. Keep it up ️🇵🇰"
Muhammad Usman Akram,https://yt3.ggpht.com/ytc/AGIKgqOK4cZ1N8eWx6Jo3VRlHEgSEbGYzph_BlHIIQ=s48-c-k-c0x00ffffff-no-rj,6 months ago,0,"Hi Ehmad, how are you doing? I'm working as shopify dev for past 1 year and previously worked as WP dev. My problem is I almost forget all of these things and now very demotivated that how will I learn these things again. I tried many times to learn new things or grab these concepts again but nothing is helping me. I love development. It gives me confidence. But now I don't know what to do."
A I.,https://yt3.ggpht.com/HRwx2HMgrydzIoJKWUU4fAf69WXq51t9ca059rXvSjGT5KteMCPYFlenvbRMu75RDONtiNBV0Q=s48-c-k-c0x00ffffff-no-rj,1 year ago (edited),0,"Great video Emaad, can you please upload a resume of you or your friend when you were fresh graduate? Just need what things to add to."
This is Sami,https://yt3.ggpht.com/kkWeJXorjit1QCmKxU7ULt4QfWY5xpSspW_5n9A5xUYPVry4ewT9bxnwkuqfMpS5Ch8M5Axi3jg=s48-c-k-c0x00ffffff-no-rj,1 year ago,0,"I will graduate this year InshAllah from Iqra University, Karachi.
I love your Videos, they are so helpful for a Cs/Se/ IT students, I always recommend your videos."
Zohaib Zahid Malik,https://yt3.ggpht.com/ytc/AGIKgqOTqgSGNWoVViur0pOwNnvv-M2S0lXuRY19Cbbm=s48-c-k-c0x00ffffff-no-rj,1 year ago,2,Very very informative especially for beginners like me. Stay blessed
Salman Ali,https://yt3.ggpht.com/ytc/AGIKgqPuV5sDFViZjEJgCASk_iStfjIblufZ38qv8trM3mA=s48-c-k-c0x00ffffff-no-rj,1 year ago,1,"Hi, This one is really a great asset for the freshers.
Thank you for your efforts."
Rizz Rullzz,,1 year ago,1,Our brother back with another masterpeice️️
Ahmad Bin Abdul Jabbar,,1 year ago,0,"Ehmad bhai coursera pe konsa course acha hy data structures ka? 
You have mentioned it in the list!"
Muhammad Shahbaz,,1 year ago,0,"I will graduate this year InshAllah from Lahore Leads University
I love your Videos, they are so helpful for a CS/SE/ IT students, I always recommend your videos."
Abdul Haseeb,,11 months ago,0,Should Domain specialists do all of this stuff after spending their time in specific domain? Plz answer this
Umer Naeem,,1 year ago,3,I am in 2nd semester. Just started learning Data structures and Algorithm and I am able to solve most medium level questions.
Programmer_py,https://yt3.ggpht.com/ytc/AGIKgqMAloQQ02QJ9ysrtpRloTuC8T4O-tOaKzBCZril=s48-c-k-c0x00ffffff-no-rj,1 year ago,0,"Quick Question. 
First of all thanks for such a great video, it covered almost every part of hiring process. 
I have a question as you methioned maybe development is not for you if you failing in technical interview.  For me i have experience and knowledge of solving any problem but I lack to get quick answer (solution) for a problem, but I noticed that when I review the code with relaxed and calm mind I get idea to solve. 
Can you please share your thoughts how to improve this."
Home Coder,https://yt3.ggpht.com/ytc/AGIKgqP4YsKO_AaRMRN_-je7wCCKqYCCXzuRWCp9ao4blLR5ZVT1MXXZdFXFhywuG1F3=s48-c-k-c0x00ffffff-no-rj,2 months ago,0,Is it necessary in Pakistan to hold a programming degree? Cant you simply get hired on the basis of your skills learnt?
Muhammad Tayyab,https://yt3.ggpht.com/ytc/AGIKgqPJimeF0aksW7PWPuh2l5zgecipwLPFVwD1Zw=s48-c-k-c0x00ffffff-no-rj,1 year ago,0,Very informative video.All the young students of Pakistan should listen your informative videos for guidance .
Naima Shaikh,https://yt3.ggpht.com/ytc/AGIKgqMiqO4z-JNyBxUKn1qGrgXblI2SxUI-I9z9bxrd=s48-c-k-c0x00ffffff-no-rj,1 year ago,0,Please share the link of udemy course you mentioned.
MR Zack,https://yt3.ggpht.com/JuvUSD4cmXgeAY073fLSf0UmQwzzxjnHDUcrncesNLfaFM7hpY_SDBgNUNj793j-2KavVIKXiw=s48-c-k-c0x00ffffff-no-rj,1 year ago,0,Thanks sir g for sharing such useful information  
Muhammad Azeem Unar,https://yt3.ggpht.com/ytc/AGIKgqMnsKWjoByy9RLMPFlR6-jY9efgaI-5Bf9MSmwsNw=s48-c-k-c0x00ffffff-no-rj,10 months ago,0,"Awesome, I am preparing for Android developer job using kotlin from last six months and graduated from Quaid Awam University Nawabshah Sindh (CS) as a fresher."
Sarah Latif Khan,https://yt3.ggpht.com/ytc/AGIKgqPllXJQ53yv-oH1DgE0W1v4t0PhcyDa_bhgFeYRGA=s48-c-k-c0x00ffffff-no-rj,1 year ago,0,Commenting for better reach ++ this is gonna help freshers.
Fatima Ali,https://yt3.ggpht.com/ytc/AGIKgqPnmSzGRv-MmhLQoJqxZdh-AJijpKCr-zWMniBeIA=s48-c-k-c0x00ffffff-no-rj,1 year ago,0,Thank you for doing this !
IA Caption,https://yt3.ggpht.com/ytc/AGIKgqOqotZS9Otg7GOnaV-lIbPjySOPKs8tMjppUl23=s48-c-k-c0x00ffffff-no-rj,1 year ago,0,"graduated in 2 weeks ago from ( Balochistan University of Information Technology, Engineering and Management Sciences )"
Musawir Butt,,1 year ago,0,Nailed it ️
Anand Kumar,,1 year ago,2,"Very Informative video. I'm a final year student of Electrical Engineering at NUST SEECS, trying to switch to the software industry."
Sammar khalil,,1 year ago,2,Plz invite a ux designer for interview
muneebwasikhan,,9 months ago,0,Masterpiece
CODE IS EASY,,1 year ago,0,Sir iam taking admition in virtual university.my aim to get skill .can I get job.what is your recommendations
ahmed aslam,,1 year ago,0,JazakAllah bro for your efforts
Farhan Bajwa,,1 year ago,0,Arbisoft fresh graduate test is for 7 semester students or who are graduated students.
Sami ullah,,1 year ago,1,Hi sir I am a junior year student but have done absolutely nothing due to switching from one field to another . I can't work consistently on a single platform . Work on Android for a month than switch to web and then so on switching how to stop it and stick to one and master it .
Diwan Muhammad Ali,,1 year ago,0,Brother please make a video about IT.
Shumaila Naz,,1 year ago (edited),2,"I've done graduation in SE 5 years ago
 got a 5 years gap and want to persue my learning for a good job .. what are your guidance for me.  Although I'm learning react and developed 2 complete projects in react..  I'm Mother of one..  Pls say something to me.."
Muhammad ali Amir,,1 year ago,0,Bhia ap ne coursera ka course datastructure and algorithms ka bhi kaha he video me us ka link  bhi daal dein
Shahbaz Ali,https://yt3.ggpht.com/ytc/AGIKgqNbq7eeg1I_RPKO5zoH5XluN0zkJ-PYF_Uhyt0UDw=s48-c-k-c0x00ffffff-no-rj,1 year ago (edited),0,"Sir please make a video on internship also, that  how we can get internship easily in 3rd or 4th semester"
sulal akbar,https://yt3.ggpht.com/ytc/AGIKgqOVWNRS7_X3qfQzTye3wqeT4TUdvP7NykCX4g=s48-c-k-c0x00ffffff-no-rj,1 year ago,1,"Sir I graduated in 2019 from Air University .. Did not have internship or experience . But I have done numerous freelancing projects in Python. Currently doing job in Bank. But now I realized the mistakes that I have made. Can I still move to IT company.
Plz reply ..."
Sammar khalil,https://yt3.ggpht.com/31FAQzVe3gldhdNwQ6hNgMSr-_iALgotPNDt1qezq8Y7gwM5H1Y79MVo09KjbYR3hkbEFFE2yg=s48-c-k-c0x00ffffff-no-rj,1 year ago,0,plz make a video on fyp guide
Ahmad Waheed,https://yt3.ggpht.com/ytc/AGIKgqN2m8GmFg33DyF4GZKPVlSKpaf4g--YsTb-9Pd0=s48-c-k-c0x00ffffff-no-rj,1 year ago,0,Finally bahi is back with a new topic.
M OWAIS Khan,https://yt3.ggpht.com/ytc/AGIKgqOtz_urwFROANoPZACvW4shJJAAg2u4Ks8w-HzTnw=s48-c-k-c0x00ffffff-no-rj,1 year ago,0,AOA Bhai. Great to see you back
Allah's Blessings,https://yt3.ggpht.com/ytc/AGIKgqNO2g9onFvxz9rK3e39xlVTu2j3ChSokeZMMSbc=s48-c-k-c0x00ffffff-no-rj,1 month ago,0,Very informative video Allah bless you sir ️️
M OWAIS Khan,https://yt3.ggpht.com/ytc/AGIKgqOtz_urwFROANoPZACvW4shJJAAg2u4Ks8w-HzTnw=s48-c-k-c0x00ffffff-no-rj,1 year ago,0,I will graduate in 6 months
Muneeb Jatt,https://yt3.ggpht.com/PH91fLpCcp-io21dJKHabUOHtJkAFoXa-LHwv_8XarakB69ZVFca5p5khnpXryKoLG4vIxdEIA=s48-c-k-c0x00ffffff-no-rj,1 year ago,0,"Punjab University jhelum=no hostel,my home,low fee
Comsats isl or bahria=hostel +100k fee structure
Please suggest me university from above"
Afraz Hussain,https://yt3.ggpht.com/ivxsHNyWJv48OizJyEc-A2srQbfNRnlv3kxJvbQ4MMB6JSrNpAAymgAUQ97HmrLRUtPTQSKY_g=s48-c-k-c0x00ffffff-no-rj,1 year ago,0,Thank you brother ️
Muhammad Ishaq,,1 year ago,0,"Sir software engineering k lie knsa laptop lena chayee h ? koi acha sa or sasta sa bta dein, jis sy sary kam hojae university k aik dafa hi lena pary 4 sal k lie aysa acha sa bta dein. video hi bna dien choti si ta k sb bachy dekh lein ya khali mujy comment me hi btta dein. Sukrya sir ."
Muhammad Talal,,1 year ago,0,Much Much Much Appreciated
HOPE Pranks,,1 year ago,0,Great job sir ....
STAR KING,,1 year ago,0,Finally zubair bhai is back yaaa
Bilal Qadri,,1 year ago,0,From university of Okara ️️
Abdul Haseeb,,11 months ago (edited),0,Kash ye pehla bna leta video to mjha bara faida hota or shaid ma b Arbisoft ma hota
Ahmed Raza,,1 year ago,0,"I am looking for work with you, but I am from Rawalpindi, are you willing to give me opportunity of remote work?"
Fasih,,1 year ago,0,Thanks bhi.
Zain Waseem,,1 year ago,0,"How to Improve Problem Solving Skills.
I Struggle to Solve Tricky Problems..."
Ahsan Ullah,,11 months ago,0,Sir kindly make complete video on QA Testing interview.
ijaz Balouch,,1 year ago,1,Emad bhi at least weakly vedio bnya kro yar gum ho jty ho
Zeeshan Suraj🎙️,,1 year ago,0,Sir BS IT Degree k bd software engineer or software developer ban skty hn Kya?
Shahid Nawab,https://yt3.ggpht.com/ytc/AGIKgqOUq-CiwE26KOMwrlxIb920fMhgXh2dpL6NDg=s48-c-k-c0x00ffffff-no-rj,1 year ago,0,Sir Kindly application form mn graduation year  update kr den... 2022.. 2021 tk show ho rha
Im Sherry,https://yt3.ggpht.com/ytc/AGIKgqPCoC3-Q9nDIoJjdVQi77NILgBPA4XJewD5d5uBBA=s48-c-k-c0x00ffffff-no-rj,1 year ago,0,"Kindly, Kindly Answer This, I'm from a small city yet I have been doing web development for 3 years now as in I'm a self taught developer my Question is how can I get job when I got no degree and only have couple of projects full stack projects which, I can add to my portfolio.. What do you think, is there any job for me there? Do I need more projects? Given That I have 3+ plus years in this field should I be applying for junior or mid-level dev? 

PS: I'm Good In HTML, CSS, SASS, Javascript (ES6), Gsap For Css Animation, Task Runner Like Gulpjs and Nodejs with expressjs in backend, ReactJS for frontend and redux for state Management."
Ahmed Raza,https://yt3.ggpht.com/ytc/AGIKgqOxQ7rhkQDkM1v1_gp7xB5AeJVlD7qoCFkPteCn=s48-c-k-c0x00ffffff-no-rj,1 year ago,1,"Kindly tell me, are you from islamabad or Rawalpindi?
What is your company name please."
Mustansar Hussain,https://yt3.ggpht.com/o3mwhqZszuYDOM-vioWn8Ry-alurbOFSeZ9UWAi_hh09dFMiCdHMwZHIKJSQnKX6Vj4agiv9vw=s48-c-k-c0x00ffffff-no-rj,1 year ago,0,Thanks sir
M OWAIS Khan,https://yt3.ggpht.com/ytc/AGIKgqOtz_urwFROANoPZACvW4shJJAAg2u4Ks8w-HzTnw=s48-c-k-c0x00ffffff-no-rj,1 year ago,1,Please help in preparing arbisoft and what is the process?
